{
  "amount": "120.00",
  "balance_due": "480.00",
  "contracted_total": "600.00",
  "created_at": "2027-11-01T10:05:00Z",
  "currency": "INR",
  "deal_id": "00000028-0000-4000-8000-000000000001",
  "id": "0000002a-0000-4000-8000-000000000001",
  "label": "MOCK UPI / NO FUNDS MOVED",
  "reference": "MOCK-UPI-SYNTHETIC",
  "status": "succeeded"
}
